U,L
"Good evening, I'm Harrison Ford.",use.social.convention
And I'm Ryan Gosling.,use.social.convention
BOTH: Welcome to the Graham Norton Show.,use.social.convention
CHEERING AND APPLAUSE,use.social.convention
"Oh, oh, oh, oh!",use.social.convention
CHEERING AND APPLAUSE,use.social.convention
"Oh, hello, what a lovely welcome back!",use.social.convention
Thank you very much everybody.,use.social.convention
"Hello, and welcome!",use.social.convention
Did you all have a nice summer?,closed.question
AUDIENCE: Yes!,respond.agree
I know some people are still on holiday.,give.statement
"They hadn't planned it that way, it's just they had",relax.atmosphere
tickets with Ryanair.,relax.atmosphere
LAUGHTER,use.social.convention
"18,000 further cancellations announced this week.",relax.atmosphere
"I mean, the whole thing could cost Ryanair ?17",relax.atmosphere
million in compensation.,relax.atmosphere
"I mean, they're hoping to make that back by",relax.atmosphere
"selling two packets of Pringles on their next flight, but, still...",relax.atmosphere
LAUGHTER,use.social.convention
"The good news, though is that Ryanair customer services have been",relax.atmosphere
very sympathetic to passengers.,relax.atmosphere
"You know, advising them to use the exits here, here and here.",relax.atmosphere
LAUGHTER AND APPLAUSE,use.social.convention
"You'll all be aware of the big news, of course.",relax.atmosphere
Twitter are trialling a plan for a new 280 character limit.,relax.atmosphere
280 characters!,relax.atmosphere
It's more than you get in Game of Thrones.,relax.atmosphere
LAUGHTER,use.social.convention
People will now be able to tweet their followers twice as many of,relax.atmosphere
their thoughts...,relax.atmosphere
LAUGHTER,use.social.convention
Uh-oh...,relax.atmosphere
"Hey, it might keep him busy so he won't have time",relax.atmosphere
to start World War three!,relax.atmosphere
Tensions with North Korea continue.,relax.atmosphere
This week leader Kim Jong-un said Donald Trump was,relax.atmosphere
"""Mentally deranged"".",recall
"Hello, kettle?",relax.atmosphere
LAUGHTER,use.social.convention
I mean...,relax.atmosphere
That's like Trump accusing Kim Jong-un of having weird hair!,relax.atmosphere
Let's get some guests on!,use.social.convention
Later we'll have music from pop icons Bananarama!,use.social.convention
CHEERING,use.social.convention
Yes!,use.social.convention
"They're back, Bananarama, and they'll be performing",use.social.convention
Cruel Summer.,use.social.convention
"But first, this Aussie star went from Neighbours' Ramsay Street",use.social.convention
to The Wolf of Wall Street and is now one of the most in-demand,use.social.convention
"actors in Hollywood - it's Margot Robbie, everybody!",use.social.convention
CHEERING,use.social.convention
It is Margot Robbie.,use.social.convention
Hello!,use.social.convention
I was looking at the curtain...,relax.atmosphere
"Is she, is she?",closed.question
"She's here, Margot Robbie!",exclamation
CHEERING AND APPLAUSE,use.social.convention
This Oscar winning star and producer has given us hits,use.social.convention
"like Legally Blonde, Walk the Line and Big Little Lies -",use.social.convention
it's a warm welcome back to Reese Witherspoon.,use.social.convention
CHEERING AND APPLAUSE,use.social.convention
Oh!,exclamation
Hello!,use.social.convention
Reese Witherspoon!,use.social.convention
And we've waited 35 years for a sequel to Blade Runner -,use.social.convention
at last it's here.,use.social.convention
Please welcome the stars of Blade Runner 2049 -,use.social.convention
Ryan Gosling and Harrison Ford.,use.social.convention
CHEERING AND APPLAUSE,use.social.convention
"Hello, sir!",use.social.convention
Very nice to see you again.,use.social.convention
"All right, that's all right, please, please, have a seat.",use.social.convention
They seem pleased!,exclamation
They seem pleased with their line-up.,use.social.convention
Lovely to see you all.,use.social.convention
"Reece and Harrison, do you know each other out of show business land?",closed.question
A little bit.,respond.agree
I've seen her in the parking lot at school!,relax.atmosphere
LAUGHTER,use.social.convention
At school!,exclamation
"At school, yeah.",relax.atmosphere
Picking up and dropping off.,give.statement
"So do you do the school run, Harrison?",closed.question
My son is now of driving age.,respond.agree
Oh.,relax.atmosphere
Yes.,relax.atmosphere
LAUGHTER,use.social.convention
"My daughter can drive, too.",give.statement
So she drives her little brother.,give.statement
"It's a different world, isn't it?",closed.question
"Here, no one drives to school.",give.statement
Really?,closed.question
"Unless they're a bus driver, they don't drive to school.",relax.atmosphere
LAUGHTER,use.social.convention
That's a good thing.,give.opinion
"Reese Witherspoon, how hot are you right now?",closed.question
"The Emmys, how many...?",closed.question
Thank you.,use.social.convention
We won eight Emmy awards.,respond.agree
APPLAUSE,use.social.convention
"Yes, a round of applause.",use.social.convention
What a brilliant night it must have been.,give.opinion
"I was nervous, though, because there were so many people",respond.agree
"nominated in our team, and instead of just, you know...",give.statement
I was just worried every single time that they talked about somebody,give.statement
"that they weren't going to win, I was just nervous.",give.statement
"So by the time we won, I went backstage and I burst into tears.",recall
Ahh.,use.social.convention
"Yeah, nervous.",respond.agree
"Ryan, the last time you were here was to celebrate La La Land.",give.statement
And of course that went on to win all sorts,give.statement
of accolades and win things.,give.statement
APPLAUSE,use.social.convention
Yes.,use.social.convention
Do,relax.atmosphere
Do you,relax.atmosphere
Do you want,relax.atmosphere
Do you want my,relax.atmosphere
Do you want my drink?,relax.atmosphere
"I want to clap, too.",relax.atmosphere
At the end of the Oscars...,give.statement
I don't know what you're talking about!,relax.atmosphere
Well...,give.statement
"At the end of the Oscars when La La Land didn't win, but had won.",give.statement
There's a picture of you...,give.statement
This is right when I think you find out that La La Land hadn't won.,give.statement
Yeah...,give.statement
What emotion is this?,closed.question
LAUGHTER,use.social.convention
It was so good!,relax.atmosphere
Did you see what the crowd looked like?,closed.question
"Oh, we've got a picture of that, the crowd were amazing.",respond.agree
Matt Damon looks like he's swallowed his own teeth!,relax.atmosphere
LAUGHTER,use.social.convention
"With shock, look at him!",exclamation
"I mean, it was like they were watching their childhood",relax.atmosphere
homes catch fire.,relax.atmosphere
LAUGHTER,use.social.convention
The Rock has never cared about anything more.,relax.atmosphere
LAUGHTER,use.social.convention
"Were you there, you guys?",closed.question
"I wasn't, I was shooting in Atlanta at the time.",respond.deny
"I was watching on TV, though.",recall
"I had a similar expression to that, yeah.",recall
"That must have been a bonkers moment, when that all went down?",closed.question
"Well, it was...",respond.agree
"You know, interesting.",give.statement
"But it was, you know, unexpected.",give.statement
"But I thought someone had been hurt, you know?",recall
"The way everyone was talking amongst themselves, it felt like someone had",recall
a heart attack or worse and it felt like someone was in danger.,recall
And then I found out that they just read the wrong name.,relax.atmosphere
LAUGHTER,use.social.convention
"Now, here's the thing, I would have thought Harrison Ford,",give.statement
"that you wouldn't like these sorts of award bashes,",give.opinion
"that you'd never go, but you do go, don't you?",closed.question
On the rare occasions that I've got anything to do with it.,respond.agree
Yeah.,use.social.convention
Which is usually presenting an award.,relax.atmosphere
LAUGHTER,use.social.convention
That's an honour.,give.statement
Is it?,relax.atmosphere
Then I've won.,relax.atmosphere
LAUGHTER,use.social.convention
"Because Margot, she is an enormous Harrison Ford fan.",give.statement
"It's true, isn't it?",closed.question
"Yeah, I am.",respond.agree
This is really weird.,relax.atmosphere
That's why we separated you.,relax.atmosphere
It's going to stay that way.,relax.atmosphere
This is your intervention.,relax.atmosphere
LAUGHTER,use.social.convention
"I mean, to be honest...",relax.atmosphere
Disabuse you of that notion.,relax.atmosphere
"And you'll help, won't you?",closed.question
Don't you worry.,relax.atmosphere
I can count on him!,relax.atmosphere
"I have to admit something, Harrison.",give.statement
"Though Indiana Jones is one of the most iconic characters ever,",give.opinion
my favourite movie that you're in is actually Six,give.statement
"Days, Seven Nights.",give.statement
Oooh...,use.social.convention
"APPLAUSE A very good movie, if you haven't seen it.",use.social.convention
I guess it's still available.,relax.atmosphere
LAUGHTER,use.social.convention
I hope so.,relax.atmosphere
"I should stay on this side of the couch, shouldn't I?",relax.atmosphere
I'm getting too excited.,relax.atmosphere
"I have a bunch of DVDs in the back of my car,",relax.atmosphere
I'll meet you out in the street.,relax.atmosphere
LAUGHTER,use.social.convention
SOMEONE BLOWING THEIR NOSE,misc
LAUGHTER,use.social.convention
"Oh, you saw it.",relax.atmosphere
LAUGHTER AND APPLAUSE,use.social.convention
"Now let's start tonight with Harrison and Ryan's movie,",give.statement
it's the much awaited Blade Runner 2049.,give.statement
"It opens on the 5th of October, and I mean the expectation,",give.statement
the hopes that this film are high.,give.statement
"Ridley Scott is involved, Harrison, you're involved.",give.statement
But presumably this isn't the first time...,give.statement
I'm not just involved.,relax.atmosphere
"You're in it, you're in it.",relax.atmosphere
You are on the poster!,relax.atmosphere
APPLAUSE,use.social.convention
"But, OK, my question is this.",give.statement
There must have been mentions of a sequel between...,give.statement
"It was 1982, wasn't it, when it came out?",closed.question
"So between then and now, so why now, why not before?",open.question
I guess because Ryan wasn't available.,relax.atmosphere
LAUGHTER,use.social.convention
For many years he was unavailable?,closed.question
"Yes, well not for 30 years.",respond.agree
But they were waiting for me to grow up.,relax.atmosphere
But they decided they'd have to go ahead anyway.,relax.atmosphere
They finally came up with a story.,give.statement
"I read it and I thought it was awesome, I thought it was great.",give.opinion
"And as I read it, I read about the character that Ryan...",recall
Ryan?,closed.question
It's Ryan.,respond.agree
LAUGHTER,use.social.convention
"That Ryan came to play and I said, with great enthusiasm,",recall
"I called up the producers and I said, this is great,",recall
"can't wait, blah, blah, blah, and what a great part...",recall
Why don't we see if we can get...,recall
Ryan.,respond.agree
Ryan Gosling.,recall
"And they said, oh, I don't...",recall
Did you say Rosling?,closed.question
Ryan Gosling.,respond.deny
"Good, right.",relax.atmosphere
"You got that on tape, Ryan Gosling?",relax.atmosphere
"And I said, it's a great part for Ryan Gosling.",give.statement
LAUGHTER AND APPLAUSE,use.social.convention
And they said we've been talking to him for months.,recall
"Now wait a second, they'd only been speaking to me for weeks.",recall
LAUGHTER,use.social.convention
So they probably would have gone ahead without me.,relax.atmosphere
No!,relax.atmosphere
No?,closed.question
No.,respond.agree
"That's what I said, no.",relax.atmosphere
"Because the fact is, Ryan, when the movie",give.statement
"came out, you were two?",closed.question
"Yeah, that's right.",respond.agree
Sorry about that!,relax.atmosphere
LAUGHTER,use.social.convention
So when did you first become aware of this film?,open.question
"I was about 12, and Harrison likes to say where was your mother and why",respond.agree
was she letting you watch it at 12?,relax.atmosphere
Well...,relax.atmosphere
That's another story.,relax.atmosphere
LAUGHTER,use.social.convention
"Let's keep this nice, OK?",relax.atmosphere
I didn't know what I was getting into.,give.statement
"I thought I was just about to watch, you know,",recall
"a regular science fiction film, I guess.",recall
Yeah.,use.social.convention
But it's a little more than that.,give.opinion
"So you are Deckard again, so who are you, Ryan?",closed.question
I play...,deflection
You want to field that one?,closed.question
Can't tell you anything about it.,respond.deny
LAUGHTER,use.social.convention
Shall we watch a clip?,closed.question
I can tell you anything!,relax.atmosphere
So the questions we were left with at the end of the first,closed.question
"Blade Runner, are they all answered in this one?",closed.question
No.,respond.deny
OK.,use.social.convention
"We'll watch a clip, this is, I believe, in the story, Ryan's",give.statement
character is looking for you.,give.statement
He finds you but he's not alone.,give.statement
They know you're here.,give.statement
I came alone.,give.statement
DRAMATIC MUSIC,misc
EXPLOSION,misc
CHEERING AND APPLAUSE,use.social.convention
"Now we saw there some action and things do take preparation,",give.statement
like fights take preparation.,give.opinion
They take a lot of preparation.,respond.agree
"Yes, now Ryan...",give.statement
Harrison feels...,give.statement
Here we go.,relax.atmosphere
"Harrison feels, Ryan, you were underprepared for one fight.",give.statement
No...,respond.deny
I know what you're referring to.,respond.agree
Yes.,respond.agree
Just say it.,relax.atmosphere
Use your words.,relax.atmosphere
Stop beating around the bush.,relax.atmosphere
He punched you.,give.statement
"Yeah, that's right.",respond.agree
"""Well, he punched you"".",recall
LAUGHTER,use.social.convention
"Yeah, of course I punched him.",relax.atmosphere
But you weren't meant to punch him.,give.statement
Right?,closed.question
"Oh, I misread the script.",respond.agree
LAUGHTER,use.social.convention
"He stepped on my foot, for Christ's sake.",relax.atmosphere
"We were doing a scene in lights, in flashing strobe lights.",recall
"He was walking backward, I was walking forward,",recall
the camera was hand-held.,recall
"You know, you have to make the punch look like it's intended.",recall
Yes.,respond.agree
But I hit him.,respond.agree
LAUGHTER,use.social.convention
One out of 100 times I hit him.,give.statement
"Right, right, I should be lucky I didn't get hit more.",relax.atmosphere
Is the theme of this.,relax.atmosphere
I apologised...,give.statement
"It's not just a punch, though, I think it's",relax.atmosphere
like a Harrison Ford punch is a different animal altogether.,relax.atmosphere
"It was not, it was not a good punch.",give.opinion
I just...,give.opinion
I will be the judge of that.,relax.atmosphere
LAUGHTER,use.social.convention
I tried to apologise.,recall
"I went to his dressing room, his palatial motorhome.",recall
With a bottle of Scotch in hand.,recall
Lovely gesture.,give.statement
"Cracked the top, poured him a drink, gave him a drink...",recall
"He said, I'm kind of busy now.",recall
LAUGHTER,use.social.convention
"And I went back to my trailer, with the rest of the bottle.",recall
LAUGHTER,use.social.convention
I had the intention to leave it but...nah!,recall
My hand hurts.,relax.atmosphere
I needed some medicine.,relax.atmosphere
"Actually we do have, there's a still, I think.",give.statement
This is the actual moment when you punched Ryan for real.,give.statement
LAUGHTER,use.social.convention
Look at his face!,give.statement
LAUGHTER,use.social.convention
"Is that the face of regret or is that just,",relax.atmosphere
I really hurt my hand?,relax.atmosphere
"No, that's the face of oh, shit, I'm in deep doo-doo.",respond.deny
"LAUGHTER Harrison Ford, here you are, Blade Runner.",use.social.convention
"But Indiana Jones, is it five, is coming next?",closed.question
Yeah.,respond.agree
APPLAUSE,use.social.convention
"Five, yes.",respond.agree
Yeah.,respond.agree
"That's all, that's definitely happening now?",closed.question
"Yes, it is.",respond.agree
"OK, just asking.",give.statement
We have a release date.,give.statement
We're working on a script.,give.statement
It will be great.,give.opinion
"I'm looking forward to working with Steven again,",give.statement
revisiting the character.,give.statement
I think that can be a good thing to do.,give.opinion
I've heard you talk about how Indiana Jones is one of those things,give.statement
"where you might as well do it because you cannot escape it,",give.statement
especially the music is a constant thing in your life.,give.statement
CHUCKLES,use.social.convention
I did a tribute for John Williams and they played,recall
"me on with the theme from Indiana Jones, and I said,",recall
I cannot escape this god dam music.,recall
"I said, and this is true, I hear it in the elevator,",recall
the last time I was lightly sedated and rolled in for a colonoscopy they,recall
were playing it on the speakers.,recall
LAUGHTER,use.social.convention
INDIANA JONES THEME TUNE PALYS,misc
#NAME?,x
CHEERING AND APPLAUSE,use.social.convention
A special treat.,relax.atmosphere
"Right, Reese Witherspoon's new movie is Home Again,",give.statement
which opens tonight.,give.statement
"Now, you look at the poster and you think, OK, it's a rom-com,",give.statement
"and it is a rom-com, but in fact it is different,",give.statement
it's kind of got an edgy twist.,give.opinion
"Yeah, my character's recently separated, she's a single mum,",respond.agree
"she is contemplating getting divorced, so she moves back",give.statement
"home to her family home, and she starts a relationship",give.statement
with a 26-year-old guy.,give.statement
CHEERING AND APPLAUSE,use.social.convention
"Because guys do all the time, so why not girls?",open.question
"Yeah, yes.",respond.agree
CHEERING AND APPLAUSE,use.social.convention
"And, you know, you're the star of the film, so do you get,",closed.question
are you in on the casting of your younger love interest?,closed.question
"Yeah, I thought it was important that I really got to know",respond.agree
the actors really well during the casting process.,relax.atmosphere
We saw a lot of guys.,relax.atmosphere
"A lot of them came back for multiple readings, but yeah,",relax.atmosphere
I think we got a really great cast.,relax.atmosphere
We've got a clip.,give.statement
This is you with your young admirer.,give.statement
This is the morning after.,give.statement
"Hey, Alice.",use.social.convention
Yeah?,use.social.convention
Do you have a minute?,closed.question
Sure.,respond.agree
Could we may be just exchange phone numbers or...?,open.question
"Harry, I'm really...",respond.deny
"Listen, I think you woke up to a completely different person",give.opinion
"than you met last night, and I appreciate the gesture,",give.statement
"I really do, but how old are you, like 30?",closed.question
29?,closed.question
28?,closed.question
Something like that.,deflection
"Oh, Jesus.",relax.atmosphere
"OK girls, come on, time to get in the car.",give.statement
"OK, OK!",relax.atmosphere
She's so intense.,relax.atmosphere
"No, I'm not.",respond.deny
"Good luck with everything, maybe I'll see you around.",use.social.convention
I hope so.,use.social.convention
"Come on, ladies.",relax.atmosphere
Did you guys have a sleepover?,closed.question
Are you friends with his mum?,closed.question
"With his mum, how old do I look?",closed.question
CHEERING AND APPLAUSE,use.social.convention
"There's three generations, there's your mum in it,",give.statement
played by the great Candice Bergen.,give.statement
"Yeah, Candy, yeah, Candice Bergen.",respond.agree
There she is.,give.statement
"In her ""Free Melania"" sweatshirt.",relax.atmosphere
LAUGHTER,use.social.convention
"She's rad, she's really cool.",give.opinion
"I've worked with her twice now, she's got great stories.",give.opinion
She actually went on a date with Donald Trump.,give.statement
When she was in college.,give.statement
It's kind of crazy.,give.opinion
It's really cool.,give.opinion
It's a great story!,exclamation
"I mean, it looks like one of those films that is just a pleasure",give.opinion
to make because of her...,give.opinion
"Yeah, it was really fun, we shot it about ten",respond.agree
minutes from my house.,give.statement
Ten minutes from school.,give.statement
So I could do the drop off and just go to work.,relax.atmosphere
But it was a great time.,give.opinion
We made it really fast and for not a lot of money.,give.statement
It was very much...,give.statement
"It was a great story to actually dig into, character wise.",give.opinion
"And your real mom, has she seen this film?",closed.question
Because I know she likes to review your work.,give.statement
"Yes, she has seen this film, yeah.",respond.agree
Good reviews?,closed.question
"She likes it, yeah, she thought it was like a feel-good movie.",respond.agree
She writes these funny text messages after she sees movies and they're,give.statement
"really short and they will be like, like the movie, three boys, hot.",recall
"Love, Mom.",recall
She liked Big Little Lies.,give.statement
You Instagrammed some texts.,give.statement
"Oh, yeah.",respond.agree
I asked if she had seen Big Little Lies when it first premiered.,recall
This was her text.,give.statement
LAUGHTER.,use.social.convention
She has reviewed some of the work of some of your couch mates.,give.statement
Yeah.,respond.agree
She liked La La Land a lot.,give.statement
"Like, a lot!",give.statement
"She was like, La La Land, singing, dancing, sexy, Ryan.",recall
Does she put Mom at the end of all of them?,closed.question
"She puts heart, Mom.",respond.agree
The reviews are in...,relax.atmosphere
"Heart, Mom.",relax.atmosphere
Is she a fan of Harrison Ford?,closed.question
Of course!,respond.agree
OK.,give.statement
"I mean, he might be one of her favourites of all time.",give.opinion
"Oh, I see...",use.social.convention
"""Might be"".",relax.atmosphere
We talked about the success of Big Little Lies at the Emmys.,give.statement
"It is extraordinary, the producing side of your life",give.opinion
is a really major part of your life and I didn't realise that went,give.statement
all the way back to Legally Blonde?,open.question
CHEERING AND APPLAUSE.,use.social.convention
"Legally Blonde 2, then?",closed.question
"Yes, I produced Legally Blonde 2.",respond.agree
It's not as good as Legally Blonde!,give.opinion
It took me a few years to get better!,give.opinion
It took me a few years to figure out the producing thing.,give.opinion
But it did take a while...,give.statement
"You would think, Reese Witherspoon, people would take you seriously,",give.statement
but how many studios passed when you were pitching,give.statement
Gone Girl as a movie?,closed.question
"Oh, yeah.",respond.agree
I got the book of Gone Girl and I took it to every studio,recall
"and every studio passed, except for one.",recall
"They were quite happy, I would imagine?",closed.question
They actually lost it after that.,respond.deny
It's kind of a crazy story.,give.opinion
Then the book hit number one and another studio came in that,recall
turned it down and bought it for five times the amount of money.,recall
"That's good, isn't it?",closed.question
I guess it's good.,respond.agree
I kind of figured out through that process that nobody reads books!,give.statement
When you try to explain it to them.,give.statement
That's good for movie-making!,relax.atmosphere
That'll keep us in business!,relax.atmosphere
"Margot, already you are tapping into that side of the business,",give.statement
you are doing a lot of producing already?,closed.question
"Yeah, our first feature will be out later this year.",respond.agree
Is that your first one?,closed.question
"Yeah, that's the first one to be released.",respond.agree
We actually have filmed two and we are in preproduction for our third.,give.statement
Wow!,relax.atmosphere
Are you in them all?,closed.question
"The first three, yes.",respond.agree
"But after this, no.",give.statement
OK.,use.social.convention
It seems like the business part of your brain was,give.statement
developed quite young?,closed.question
You were a little girl and you were quite business savvy.,give.statement
I was quite savvy as a kid.,respond.agree
I would steal my brother's toys and sell them on the side of,recall
the road for an extortionate price.,recall
I would make up magic tricks and make my family pay to come,recall
and see my magic show and then pay extra if they wanted to know,recall
how I did the trick!,recall
That's a really good idea!,exclamation
You would pay extra to find out how they do the tricks.,relax.atmosphere
"Once you get them in, they already paid their dollar, sure!",relax.atmosphere
"Because, Ryan, you were also a young entrepreneur, weren't you?",closed.question
I wouldn't say that.,respond.deny
"Didn't your father, he wanted you to sell, was it cellophane?",closed.question
My parents came upon a truck of cellophane somehow.,recall
I was asked not to ask too many questions.,recall
I just suddenly...,recall
