U,L
There was a basement filled with cellophane.,recall
And they encouraged me to go to school and see,recall
if I could sell it to my teachers.,recall
I put a few in my backpack and tried to hock them at recess.,recall
Convince kids that they might be good stocking stuffers,recall
for their parents.,recall
What are the uses of cellophane?,closed.question
How did it go?,closed.question
"What do you mean, what are the uses of cellophane?",closed.question
I know the name but I don't know what to do with it.,give.statement
"You wrap sandwiches in it, it keeps things fresh.",give.statement
"Oh, OK.",give.statement
I'm sorry.,give.statement
"No, it was an important question, you needed to ask it.",relax.atmosphere
"I'm not doing a good job of selling it, obviously.",relax.atmosphere
Did you sell it?,closed.question
"There's still some left, if you're interested?",relax.atmosphere
"Knowing that it keeps things fresh, I want some.",relax.atmosphere
"The dream would be someone would just say, I'll take all of it!",give.statement
Never happened.,relax.atmosphere
That's a weird story.,relax.atmosphere
"It is a bit weird, now you tell it.",respond.agree
It seemed like a good idea at the time.,relax.atmosphere
"Harrison, famously you worked as a carpenter in your early life.",give.statement
"But you studied woodwork with your father, but he wasn't that good.",give.opinion
My dad was in advertising and he liked to make things,respond.agree
and we were down in the basement working on building a table,recall
and he cut off his finger.,recall
Why are you laughing?,closed.question
He's laughing!,exclamation
It's quite funny when it's told like that.,relax.atmosphere
It wasn't funny.,respond.deny
At the time.,recall
I was 16 years old.,recall
I had not much experience with this but I wrapped my dad's hand up,recall
and I got him upstairs and I called the police and then I ran downstairs,recall
and I picked up the finger and I put it in a Kleenex and this was a long,recall
time ago so when I got to the emergency ward I said...,recall
Here's my dad's...,recall
And he went...,recall
"And threw it in the bin, in the trash bin.",recall
Because it was a while ago and they didn't really think,recall
about trying to attach fingers.,recall
If only you had some cellophane.,relax.atmosphere
Yeah!,exclamation
Thank you.,relax.atmosphere
Who knew?,relax.atmosphere
Yeah.,relax.atmosphere
Did he just have no finger?,closed.question
He had no finger here.,respond.agree
He cut off about this much of this finger.,give.statement
Why are you pointing that at me?,closed.question
I'm not pointing it at you.,respond.deny
He got about halfway through this finger as well.,recall
But they were able to save that.,recall
"But my father, he used to admonish me sometimes",recall
and he would point at me.,recall
But he would be pointing at me but his finger was going like that.,recall
So I would always look...,relax.atmosphere
It really made him mad.,recall
APPLAUSE.,use.social.convention
"Reece, very quickly, to bring you back to Legally Blonde,",give.statement
"there was a thing last year, when it hit the headlines...",give.statement
"President Trump, he made the commencement speech.",give.statement
"Oh, yeah.",respond.agree
And then it turned out it bore quite a strong resemblance to Elle's,give.statement
speech in Legally Blonde.,give.statement
Yeah.,respond.agree
It did!,respond.agree
Was it Jimmy Fallon who found this out?,closed.question
It was all over the internet.,give.statement
Maybe it was on Jimmy's show.,respond.agree
"If you haven't seen it, it's sort of unbelievable.",give.opinion
Show them the thing?,closed.question
As we take our next steps into the world.,misc
We must go forth into the world.,misc
It is with passion.,misc
Passion.,misc
Courage of conviction.,misc
Courage in your convictions.,misc
And strong sense of self.,misc
Be true to yourself.,misc
We did it.,misc
I did it.,misc
APPLAUSE.,use.social.convention
Had you not seen that?,closed.question
No!,respond.deny
I have never seen that and I always fall down YouTube rabbit holes,give.statement
and I missed that completely!,give.statement
He is better when he sticks to the script.,relax.atmosphere
APPLAUSE.,use.social.convention
Do you know how that happened?,closed.question
Is he just a fan of the film?,closed.question
I'm sure he's just a big fan.,relax.atmosphere
Very bizarre.,relax.atmosphere
"Let's move on to Margot Robbie's movie, it's a very British movie,",give.statement
it's called Goodbye Christopher Robin.,give.statement
It opens tonight.,give.statement
And it's the real story and a much darker story than you think it's,give.opinion
"going to be of AA Milne, the man who created",give.opinion
the Winnie the Pooh stories.,give.statement
"Yeah, Winnie the Pooh was always prevalent throughout my childhood",respond.agree
but I had never wondered its origins or why or when it was written.,give.statement
It was written right between World War I and World War II,give.statement
"and AA Milne, the author, very famous author, actually",give.statement
fought in World War I.,give.statement
And part of the reason it was so successful is because it,give.opinion
came at a time when the country was very damaged and the world,give.statement
was damaged and people kind of felt they were robbed,give.statement
"of their innocence, probably.",give.opinion
And the books became this safe place for people and became,give.opinion
this global phenomenon.,give.statement
"And Domhnall Gleeson plays AA Milne and you play Daphne,",give.statement
his wife and the mother of Christopher Robin.,give.statement
Yeah.,respond.agree
She's a piece of work.,give.statement
She is complicated.,respond.agree
Yes.,respond.agree
She is not immediately likeable and maybe she is not even that,give.opinion
likeable by the end...,give.opinion
I really love her.,give.opinion
"She had her own trauma, he was dealing with PTSD,",give.statement
although it was not really coined that term back then.,give.statement
They didn't really speak about it then.,give.statement
And she had postnatal depression and they didn't,give.statement
really talk about that.,give.statement
"There was a lot of stiff upper lip, not talking about your feelings.",give.statement
"But they had this child and he was brilliant and Will,",give.statement
"who plays him, is the most gorgeous kid you have ever seen -",give.statement
a brilliant actor.,give.opinion
"He makes everyone cry when they see it, including myself,",give.statement
and I know what's going to happen in the film but I still cry.,give.statement
And they love him but they kind of end up ruining his childhood,give.opinion
by him becoming so famous.,give.opinion
Because that was the thing I didn't understand.,give.statement
"Christopher Robin became a sort of Shirley Temple,",give.opinion
Macauley Culkin figure.,give.opinion
"That's what they said, he was the Macauley Culkin of his time.",respond.agree
Yeah.,respond.agree
There was no real distinction between him in real life,give.statement
and him on the books.,give.statement
"His name is Christopher Robin, he was drawn, he was",give.statement
photographed everywhere.,give.statement
It was pretty traumatic for him.,give.opinion
So there are some of those sad parts to it.,give.opinion
"But there's also a lot of nice, happy moments, too.",give.opinion
"This is one of the nice, happy moments.",give.opinion
This is you entertaining young Christopher Robin,give.statement
with the original bear.,give.statement
"Well, I say, this is an unexpected pleasure.",use.social.convention
Have you come to see my woods?,closed.question
Are they really your woods?,closed.question
"Oh, yes.",respond.agree
As far as the eye can see.,respond.agree
"Well, a bear does feel more at home in the woods",give.opinion
amongst the wild animals.,give.opinion
Are there really wild animals?,closed.question
I can't continue this conversation until we have been,deflection
properly introduced.,deflection
I'm Billy Moon.,use.social.convention
And you're teddy bear.,use.social.convention
"Edward Bear, if you don't mind.",use.social.convention
I don't like that name.,respond.deny
Mummy will have to think of a new one.,give.opinion
You do know it's me talking and not a bear?,closed.question
I was just playing.,give.statement
"Yes, I was just joining in.",respond.agree
APPLAUSE.,use.social.convention
He's so sweet.,give.opinion
And a very good English accent.,give.opinion
Great!,respond.agree
Thank you.,use.social.convention
A very specific English accent?,closed.question
"Yes, it's like a 1930s one.",respond.agree
"And an aristocratic Englishwoman, it's very specific, not just",give.statement
a traditional RP accent.,give.statement
I hear you had a mental trick for getting yourself into it?,closed.question
"Yeah, when I'm doing accents I need a phrase to get into it.",respond.agree
"When I did Wolf of Wall Street, I had a phrase and when",recall
I did this one I...,recall
So in Wolf of Wall Street I would be like...,recall
"NEW YORK ACCENT: I'm not talking to you, I'm talking to her.",recall
"OK, I'm ready to do it.",recall
"On this one, it was...",recall
"POSH ACCENT: I'm so happy, no, I simply couldn't do that.",recall
It's not a line in the script or anything and it doesn't,give.statement
make sense as a line.,give.opinion
"It was like, I don't know...",give.statement
"The thing I would say, and it helped me.",give.statement
You are kind of an honorary Brit because you have,give.opinion
spent a lot of time here.,give.opinion
How long did you live here for?,closed.question
I just begrudgingly moved...,respond.agree
We have a production office in LA.,give.statement
But I was living here for the last three years.,give.statement
OK.,use.social.convention
And I don't know why I would be surprised,give.statement
"because you are Margot Robbie living in London, so of course you did...",give.statement
But you did mix in some highfalutin circles?,closed.question
"Yes, oh yes.",respond.agree
I don't know where this picture came from...,relax.atmosphere
That's obviously you.,give.opinion
Is that Sienna Miller?,closed.question
"Yeah, I think so.",respond.agree
And that's a princess.,give.statement
Is that a Beatrice one or a Eugenie one?,closed.question
I can't tell by the picture.,deflection
It kind of looks weird.,give.opinion
You are picking everyone better than I can.,relax.atmosphere
I think it's one of them.,give.opinion
Tell us who this is.,give.statement
You know who that is.,deflection
"I know, but tell us.",respond.agree
It's Prince Harry.,give.statement
I don't normally go to parties where those people are there.,give.statement
That was a one-off.,give.statement
That doesn't normally happen.,give.statement
My friends aren't Royals!,give.statement
"There, of course, is Cara Delvingne.",give.statement
She is a good friend of mine.,respond.agree
You were in Suicide Squad together.,closed.question
Yes.,respond.agree
She was awesome.,give.opinion
"In Suicide Squad, you tattooed the cast members, is this right?",closed.question
Yes.,respond.agree
Because you were trained...,give.statement
These are the tattoos you do.,give.statement
"Yeah, we called them Toemojis.",respond.agree
Oh?,use.social.convention
OK.,use.social.convention
And did you do all the cast?,closed.question
"No, funnily enough, no one else wanted them!",respond.deny
"So, just the two of us got the Toemojis.",give.statement
But everyone else got squad written on them and other people would come,recall
by the trailer and get anything.,recall
"Yes, we did all sorts of things.",respond.agree
So you can still tattoo people?,closed.question
"Yet, I reckon I have done...",respond.agree
"Yeah, getting close to 100.",respond.agree
Little ones.,give.statement
"And honestly, they are probably getting worse as they go along.",give.opinion
Because we have a tattoo gun here.,give.statement
If anyone...,give.statement
If any of your coach mates want a tattoo?,open.question
To commemorate this lovely evening?,open.question
LAUGHTER.,use.social.convention
You pierced your ear.,give.statement
I what?,open.question
You pierced your ear.,give.statement
"Yeah, not myself.",relax.atmosphere
It would be so funny.,relax.atmosphere
Please?,closed.question
Bless you for thinking it might...,relax.atmosphere
I have seen you actually are prepared...,give.statement
Yes.,respond.agree
She can tattoo at will.,give.statement
"This is not actually my gun but I can make do with it, for sure.",give.statement
You're genuinely thinking about this?,closed.question
No!,respond.deny
I didn't think you were.,respond.agree
I thought you were!,exclamation
That's acting!,relax.atmosphere
APPLAUSE.,use.social.convention
Ryan isn't looking so shocked because you have already tattooed,give.statement
"yourself, haven't you?",closed.question
Yeah.,respond.agree
How did that go for you?,open.question
Not great.,respond.agree
What did you do?,open.question
"It was, you know, it was supposed to be a monster hand",give.statement
dropping a bloody heart.,give.statement
But it looks more like a chicken...,give.opinion
Making love with a cactus or something.,give.opinion
I don't know what happened.,give.statement
"My friend had one at his house, I like to doodle,",give.statement
it's a bad combination.,relax.atmosphere
Do you have a tattoo?,closed.question
"Oh, God.",relax.atmosphere
I knew you were going to ask that.,relax.atmosphere
Do you?,closed.question
"Yeah, I do.",respond.agree
Where is it?,open.question
I went to college in the '90s.,give.statement
Can we just leave it there.,give.statement
Is it a tramp stamp?,closed.question
No!,respond.deny
"Oh, God, no!",exclamation
Is it a dolphin?,closed.question
"No, no, no.",respond.deny
Is it a...?,closed.question
I'm not getting it.,deflection
"The thing is, there is someone who works on our team and they are",give.statement
a big Margot Robbie fan.,give.statement
"And when I say they are willing to do this, I mean they are very keen.",give.statement
"He has washed his feet, talced them.",give.statement
Is it difficult to do this Toemoji thing?,closed.question
No.,respond.deny
"Adam, your moment is here, this is happening.",use.social.convention
"So, sit down beside Margot, there.",use.social.convention
I don't mean to criticise my own production team,relax.atmosphere
but you could have taken your shoes and socks off first.,relax.atmosphere
It would have saved a little time.,relax.atmosphere
You knew this moment was coming.,give.statement
I wanted to make it more real.,relax.atmosphere
"OK, here we go.",relax.atmosphere
You don't have to do this if you don't want to.,relax.atmosphere
"Honestly, he kept saying he wants to do this.",give.statement
Are you sure?,closed.question
OK.,respond.agree
"Oh, my God.",exclamation
There is something I have to say...,use.social.convention
Don't try this at home!,exclamation
Really don't!,exclamation
I will sit on this side of you.,give.statement
"OK, perfect.",give.statement
"OK, here we go.",give.statement
In your own time.,relax.atmosphere
It is not that easy to do!,exclamation
Here we go.,relax.atmosphere
I haven't actually done one for a while.,give.statement
I'm probably more nervous than you are.,give.statement
"Sorry, that's not comforting!",exclamation
That wasn't very professional.,give.statement
I'm so scared!,exclamation
I was going to say my hands are shaking but you don't,relax.atmosphere
want to hear that.,relax.atmosphere
TATTOO GUN BUZZES.,misc
This is nuts!,exclamation
APPLAUSE.,use.social.convention
OK.,relax.atmosphere
Sorry!,exclamation
TATTOO GUN BUZZES.,misc
Does it hurt?,closed.question
It's a little funny.,respond.agree
Don't worry about your finest work.,relax.atmosphere
"You do seem happy in your work, I'll give you that.",give.opinion
I really do.,respond.agree
I'm not particularly good but I like doing it.,give.statement
APPLAUSE.,use.social.convention
"Good poker face, Adam, very good.",relax.atmosphere
"Sorry, is that all right?",closed.question
It's good.,respond.agree
I can neaten it up when we are backstage.,give.statement
CHEERING AND APPLAUSE.,use.social.convention
Show it to that camera.,give.statement
There it is!,exclamation
That's not bad!,give.opinion
It's not bad!,respond.agree
"Obviously, trained medics are coming to the studio.",relax.atmosphere
"In the meantime, it's time for music.",give.statement
These pop pioneers have sold over 40 million records and are one,give.statement
of the greatest girl bands of all time.,give.statement
Now the original line-up is back - hurrah!,give.statement
"Performing Cruel Summer, please welcome Bananarama!",give.statement
CHEERING AND APPLAUSE.,use.social.convention
# Hot summer streets.,misc
# And the pavements are burning.,misc
# I sit around.,misc
# Trying to smile.,misc
# But the air is so heavy and dry.,misc
# Strange voices are saying.,misc
# What did they say.,misc
# Things I can't understand.,misc
# It's too close for comfort.,misc
# This heat has got.,misc
# Right out of hand.,misc
"# It's a cruel, cruel summer.",misc
# Leaving me here on my own.,misc
"# It's a cruel, cruel summer.",misc
# Now you're gone.,misc
# The city is crowded.,misc
# My friends are away.,misc
# And I'm on my own.,misc
# It's too hot to handle.,misc
# So I got to get up and go.,misc
"# It's a cruel, cruel summer.",misc
# Leaving me here on my own,misc
"# It's a cruel, cruel summer.",misc
# Now you're gone.,misc
"# It's a cruel, cruel summer.",misc
# Leaving me.,misc
# Leaving me here on my own.,misc
"# It's a cruel, cruel summer.",misc
# Now you're gone.,misc
"# It's a cruel, cruel summer.",misc
# Leaving me here on my own.,misc
"# It's a cruel, cruel summer.",misc
# Now you're gone.,misc
"# It's a cruel, cruel summer.",misc
# Leaving me here on my own.,misc
"# It's a cruel, cruel summer.",misc
# Now you're gone.,misc
"# It's a cruel, cruel summer.",misc
# Now you've gone.,misc
CHEERING AND APPLAUSE.,use.social.convention
"Oh, Bananarama, everybody!",use.social.convention
"So, so good.",give.opinion
"Come on over, ladies.",give.statement
Here they are!,use.social.convention
CHEERING AND APPLAUSE,use.social.convention
"Very lovely to see you, hello, my darling.",use.social.convention
Hello.,use.social.convention
Hello!,use.social.convention
Come and sit down.,give.statement
"I think, I think you'll all fit on.",use.social.convention
Will we all fit on?,closed.question
Hi.,use.social.convention
I think we'll all fit in.,respond.agree
There we go.,relax.atmosphere
Bananarama back in the world.,give.statement
"We're all squeeze on, yes.",respond.agree
"We're good, we're good, we won't be here for long.",give.statement
"So, Bananarama, honestly, a great night for the 80s.",give.opinion
"Blade Runner back, now Bananarama.",give.statement
CHEERING,use.social.convention
"Obviously Britain really excited that Bananarama are back,",give.opinion
but we forget it's a global thing.,give.opinion
Yeah.,respond.agree
"Cruel Summer, that was a top ten hit in America, wasn't it?",closed.question
Yes.,respond.agree
It's still remembered fondly.,give.statement
I often hear it in the supermarket.,relax.atmosphere
LAUGHTER,use.social.convention
And it's in Blue Crush.,give.statement
That's right.,respond.agree
"The first time we thought we'd actually maybe made it was in LA,",recall
"because we were coming back from breakfast, about to go",recall
"to the beach, on the bus, in Santa Monica, on the bus.",recall
And we saw Mike Tyson sitting on the front of his limo,recall
"and he started singing Cruel Summer at us, and we were like wow.",recall
LAUGHTER,use.social.convention
We made it!,exclamation
With our beach bags.,recall
"And this is a tour, you're back for a tour.",give.statement
Yes.,respond.agree
We've got we've got Siobhan back in the fold for a tour.,give.statement
We've never actually toured together.,give.statement
We went on a world tour just after Siobhan left.,give.statement
Just after I left.,relax.atmosphere
LAUGHTER,use.social.convention
Bye!,relax.atmosphere
And it was great.,give.opinion
But we've never actually done anything together.,give.statement
"The tickets sold out, because the response was so fantastic.",give.statement
"We had to add another ten dates, which was...",give.statement
"I'm not sure how we're going to manage it, to be honest.",give.statement
We've got 23 dates now between November than 9th and,give.statement
December the 9th.,give.statement
OK.,use.social.convention
At our age!,relax.atmosphere
LAUGHTER,use.social.convention
It is so great to have Bananarama back in our world.,give.opinion
"Ladies and gentlemen, Bananarama!",give.statement
CHEERING AND APPLAUSE,use.social.convention
Bananarama!,relax.atmosphere
"OK, that is nearly it.",give.statement
"But before we go, let's make our first visit of the new series",give.statement
to the Big Red Chair.,give.statement
Who's there?,closed.question
Hello.,use.social.convention
Hello.,use.social.convention
"Hi, what's your name?",use.social.convention
Justine.,use.social.convention
"Justine, and what do you do, Justine?",closed.question
I'm a barrister.,respond.agree
And actual barrister?,closed.question
Yes.,respond.agree
Like a working one?,closed.question
Yes.,respond.agree
Like people might see you in courts over the coming weeks?,closed.question
"Yes, yes.",respond.agree
"And you've chosen to do this, OK!",relax.atmosphere
LAUGHTER,use.social.convention
Off you go with your story.,give.statement
"My mother's a very conservative Irish lady, and she is naturally",recall
"protective of me and of my daughters, her grandchildren,",recall
and she's always going on about all the weirdos there are in the world,recall
that the girls have got to avoid.,recall
"And one particular day my eldest daughter, who was then 14,",recall
"wanted to go to the zoo with a girlfriend of hers,",recall
"a little friend, but no adults, and, of course, my mother thought this",recall
was an appalling idea.,recall
"How could that possibly happen, there's weirdos",recall
everywhere at the zoo.,recall
"The 14-year-old, in the sort of attempt to placate granny said,",recall
"well, you know, perhaps the Anaconda keeper's a bit weird,",recall
"to which my mother, not realising what she said,",recall
grandma just turned around and said...,recall
"""You make sure that if anyone asks you to come and look",recall
"at his Anaconda, you say no.""",recall
LAUGHTER,use.social.convention
"That's a great story, you can walk, you can walk.",give.opinion
"No, flip me!",respond.deny
Oh you want to be flipped.,give.statement
"OK, there you go!",give.statement
Well done.,give.statement
CHEERING AND APPLAUSE,use.social.convention
"If you'd like to join us on the show and have a go in the big red chair,",give.statement
you can contact us via our website at this very address.,give.statement
That's it for tonight - please say thank you to my,give.statement
"guests, Bananarama...",give.statement
CHEERING AND APPLAUSE,use.social.convention
Margot Robbie...,use.social.convention
CHEERING AND APPLAUSE,use.social.convention
Reese Witherspoon...,use.social.convention
CHEERING AND APPLAUSE,use.social.convention
Ryan Gosling...,use.social.convention
CHEERING AND APPLAUSE,use.social.convention
"And, Mr Harrison Ford!",use.social.convention
CHEERING AND APPLAUSE,use.social.convention
"Join me next week with rock star Liam Gallagher,",use.social.convention
"legendary stand-up Chris Rock, actor Idris Elba and",use.social.convention
Oscar-winner Kate Winslet.,use.social.convention
I'll see you then!,use.social.convention
"Goodnight everybody, goodbye!",use.social.convention
I am a fine-tuned moneymaking machine.,use.social.convention
